{"schema_version":"1","collection":"uk-vehicle-source-ledger","updated_at":"2026-07-25","type_id_status_default":"community-candidate","scope_note":"Initial Stage 36A candidate ledger. Game vehicle type IDs are community-observed until reproduced from the current UK game. Official Help Centre sources verify only the labels and attributes they publish.","sources":{"community-type-map":"https://greasyfork.org/en/scripts/585892-missionchief-unit-naming-tool/code","official-psu-vehicles":"https://xyrality.helpshift.com/hc/en/23-mission-chief/faq/1740-which-psu-vehicles-are-available-uk-version/","official-search-rescue-vehicles":"https://xyrality.helpshift.com/hc/en/23-mission-chief/faq/1836-what-search-and-rescue-vehicles-are-available-uk-version/","official-foam-vehicles":"https://xyrality.helpshift.com/hc/en/23-mission-chief/faq/1708-which-vehicles-can-carry-foam/","official-large-police-depot":"https://xyrality.helpshift.com/hc/en/23-mission-chief/faq/1741-what-is-the-large-police-depot-uk-version/","community-vehicle-catalogue":"https://missionchief-uk.fandom.com/wiki/Vehicles","official-helicopter-station":"https://xyrality.helpshift.com/hc/en/23-mission-chief/faq/1523-what-is-a-helicopter-station/","official-patient-transport":"https://xyrality.helpshift.com/hc/en/23-mission-chief/faq/1884-how-do-patient-transport-missions-work/","official-critical-transport":"https://xyrality.helpshift.com/hc/en/23-mission-chief/faq/1885-how-do-critical-transport-missions-work/","community-recovery-evidence":"https://board.missionchief.com/forum/index.php?action=firstNew&thread%2F10925-jxshy-s-graphics-packs-development-update-and-help-needed-uk%2F=","community-cell-van-evidence":"https://board.missionchief.com/forum/index.php?pageNo=2&user-post-list%2F358-whitchit%2F="},"columns":["game_vehicle_type_id","name","canonical_id","service","resource_class","label_status","source_keys","notes"],"records":[[3,"Fire Officer","fire_officer","fire_and_rescue","vehicle","candidate",["community-type-map"],[]],[4,"Rescue Support Unit (RSU)","rescue_support_vehicle","fire_and_rescue","vehicle","candidate",["community-type-map"],[]],[5,"Ambulance","ambulance","ambulance","vehicle","candidate",["community-type-map"],[]],[6,"Water Carrier","water_carrier","fire_and_rescue","vehicle","candidate",["community-type-map"],[]],[7,"HazMat Unit","hazmat_unit","fire_and_rescue","vehicle","candidate",["community-type-map"],[]],[8,"Police Car","police_car","police","vehicle","candidate",["community-type-map"],[]],[9,"Air Ambulance","air_ambulance","ambulance","aircraft","verified",["community-type-map","official-helicopter-station"],[]],[10,"RRV","rapid_response_vehicle","ambulance","vehicle","candidate",["community-type-map"],[]],[11,"Police Helicopter","police_helicopter","police","aircraft","candidate",["community-type-map"],[]],[12,"DSU","dog_support_unit","police","vehicle","candidate",["community-type-map"],[]],[15,"Incident Command and Control Unit","iccu","ambulance","vehicle","candidate",["community-type-map"],[]],[16,"Rescue Pump","rescue_pump","fire_and_rescue","vehicle","candidate",["community-type-map","community-vehicle-catalogue"],[]],[17,"Combined Aerial Rescue Pump","combined_aerial_rescue_pump","fire_and_rescue","vehicle","candidate",["community-type-map","community-vehicle-catalogue"],[]],[20,"Operational Team Leader","operational_team_leader_vehicle","ambulance","vehicle","candidate",["community-type-map","community-vehicle-catalogue"],["Abbreviated or community-observed label requires exact in-game market confirmation before promotion."]],[25,"Armed Traffic Car","armed_traffic_car","police","vehicle","verified",["community-type-map","official-large-police-depot","community-vehicle-catalogue"],[]],[26,"Heavy 4x4 Tanker","heavy_4x4_tanker","fire_and_rescue","vehicle","candidate",["community-type-map"],[]],[27,"PRV","prv","ambulance","vehicle","candidate",["community-type-map"],[]],[28,"SRV","srv","ambulance","vehicle","candidate",["community-type-map"],[]],[29,"Welfare Vehicle","welfare_vehicle","ambulance","vehicle","candidate",["community-type-map"],[]],[30,"ATV","atv_carrier","ambulance","vehicle","candidate",["community-type-map"],[]],[33,"Mass Casualty Equipment","mass_casualty_equipment","ambulance","equipment","candidate",["community-type-map"],[]],[34,"Ambulance Officer","ambulance_officer_vehicle","ambulance","vehicle","candidate",["community-type-map","community-vehicle-catalogue"],[]],[35,"Bulk Foam Unit","bulk_foam_unit","fire_and_rescue","vehicle","verified",["community-type-map","official-foam-vehicles"],["Abbreviated or community-observed label requires exact in-game market confirmation before promotion."]],[36,"Water/Foam Carrier","water_foam_carrier","fire_and_rescue","vehicle","verified",["community-type-map","official-foam-vehicles"],["Abbreviated or community-observed label requires exact in-game market confirmation before promotion."]],[38,"Rescue Pump with CAFS","rescue_pump_with_cafs","fire_and_rescue","vehicle","verified",["community-type-map","official-foam-vehicles"],["Abbreviated or community-observed label requires exact in-game market confirmation before promotion."]],[39,"Operational Support Unit","operational_support_unit","fire_and_rescue","vehicle","candidate",["community-type-map","community-vehicle-catalogue"],[]],[51,"PSU Carrier","psu_carrier","police","vehicle","verified",["community-type-map","official-large-police-depot","official-psu-vehicles"],[]],[54,"Detention Van","detention_van","police","vehicle","verified",["community-type-map","official-large-police-depot","official-psu-vehicles"],[]],[55,"Mounted Unit","mounted_unit","police","vehicle","verified",["community-type-map","official-large-police-depot","official-psu-vehicles"],[]],[56,"M-RAV","m_rav","police","vehicle","verified",["community-type-map","official-large-police-depot","official-psu-vehicles"],["The exact official label is M-RAV; MRAV is retained as an alias in the canonical record."]],[57,"Coastguard Rescue Vehicle","coastguard_rescue_vehicle","coastguard","vehicle","verified",["community-type-map","official-search-rescue-vehicles"],[]],[58,"Mud Rescue Unit","coastguard_mud_rescue_unit","coastguard","vehicle","verified",["community-type-map","official-search-rescue-vehicles"],[]],[59,"Coastguard Rope Rescue Unit","coastguard_rope_rescue_unit","coastguard","vehicle","verified",["community-type-map","official-search-rescue-vehicles"],[]],[60,"Coastguard Commander","coastguard_commander","coastguard","vehicle","verified",["community-type-map","official-search-rescue-vehicles"],[]],[61,"Flood Rescue Unit (Trailer)","flood_rescue_unit_trailer","coastguard","trailer","verified",["community-type-map","official-search-rescue-vehicles"],["Official guidance verifies a Flood Rescue Unit Trailer product, but the current canonical flood_rescue_unit record does not yet distinguish this trailer identity."]],[62,"Flood Rescue Unit","flood_rescue_unit","fire_and_rescue","vehicle","verified",["community-type-map","official-search-rescue-vehicles"],["Mapped to the current generic Flood Rescue Unit canonical identity; trailer and vehicle variants still require direct market observation."]],[63,"Support Unit","coastguard_support_unit","coastguard","vehicle","verified",["community-type-map","official-search-rescue-vehicles"],[]],[65,"Coastguard Rescue Helicopter (Large)","coastguard_rescue_helicopter_large","coastguard","aircraft","candidate",["community-type-map"],["The current canonical helicopter record is generic; small/large market variants require separate confirmation before mapping."]],[66,"4x4 Vehicle","lifeboat_4x4_vehicle","lifeboat","vehicle","verified",["community-type-map","official-search-rescue-vehicles"],[]],[67,"Inland Rescue Boat (Trailer)","inland_rescue_boat_trailer","lifeboat","trailer","verified",["community-type-map","official-search-rescue-vehicles"],["The community source label “ILB Trainer” is treated as a typographical form of the official Inland Rescue Boat trailer identity."]],[68,"ILB","inshore_lifeboat","lifeboat","vessel","verified",["community-type-map","official-search-rescue-vehicles"],[]],[69,"ALB","all_weather_lifeboat","lifeboat","vessel","verified",["community-type-map","official-search-rescue-vehicles"],[]],[70,"Rescue Watercraft Trailer","rescue_watercraft_trailer","lifeboat","trailer","verified",["community-type-map","official-search-rescue-vehicles"],[]],[71,"Hovercraft Trailer","hovercraft_trailer","lifeboat","trailer","verified",["community-type-map","official-search-rescue-vehicles"],[]],[72,"Hovercraft Transporter","hovercraft_transporter","lifeboat","vehicle","verified",["community-type-map","official-search-rescue-vehicles"],[]],[73,"Light 4x4","light_4x4","fire_and_rescue","vehicle","verified",["community-type-map","official-search-rescue-vehicles"],[]],[74,"Boat Trailer","boat_trailer","fire_and_rescue","trailer","verified",["community-type-map","official-search-rescue-vehicles"],[]],[75,"Major Foam Tender","major_foam_tender","airfield_operations","vehicle","candidate",["community-type-map"],[]],[76,"RIV","riv","airfield_operations","vehicle","candidate",["community-type-map"],[]],[77,"Airfield Command","airfield_firefighting_command_vehicle","airfield_operations","vehicle","candidate",["community-type-map"],[]],[78,"Rescue Stairs","rescue_stairs","airfield_operations","vehicle","candidate",["community-type-map"],[]],[79,"Airfield Operations Vehicle","airfield_operations_vehicle","airfield_operations","vehicle","candidate",["community-type-map"],[]],[80,"Airfield Operations Supervisor","airfield_operations_supervisor_vehicle","airfield_operations","vehicle","candidate",["community-type-map","community-vehicle-catalogue"],[]],[81,"Medical Equipment Trailer","medical_equipment_trailer","airfield_operations","trailer","candidate",["community-type-map","community-vehicle-catalogue"],[]],[85,"Control Van SAR","control_van","search_and_rescue","vehicle","candidate",["community-type-map"],[]],[86,"O